{
  "_sample_comment": "这是一个 sample，文件实质完成后删掉这行注释",
  "experiment_id": "experiment-2026-001-derived-author-distinction-sample",
  "analysis_status": "not-run",
  "condition_summary": {},
  "evaluator_agreement": null,
  "excluded_run_count": 0,
  "failure_case_count": 0,
  "conclusion_supported": null
}
